{
  "$comment": "GENERATED by contracts/codegen/generate.py from episode.schema.yaml - DO NOT EDIT.",
  "$schema": "https://json-schema.org/draft/2020-12/schema",
  "additionalProperties": true,
  "description": "The central join-point episode record (sidecar + operational, resolved as-of recorded_at) \u2014 CONTRACT \u00a73.2.",
  "properties": {
    "archive": {
      "description": "0/1 \u2014 soft discard (DESCARTAR; archive bucket, not training set).",
      "type": "integer"
    },
    "bimanual_episode_id": {
      "description": "Fob-injected shared L/R id; pairs the two wrist cams of ONE take (distinct from episode_id).",
      "type": "string"
    },
    "calibration_id": {
      "description": "Optional calibration reference (scope none/fleet/per_camera; C-11).",
      "type": [
        "string",
        "null"
      ]
    },
    "capture_stack_id": {
      "description": "Capture-stack reference (forensic provenance, B-9).",
      "type": [
        "string",
        "null"
      ]
    },
    "display_id": {
      "description": "DERIVED human handle <YYYYMMDD>_<operator>_<station>_<NNNNNN>; never a key (\u00a77).",
      "type": "string"
    },
    "episode_id": {
      "description": "UUIDv4 pairing/join key, minted by the fob, identical on both arms (\u00a77). The ONLY join key.",
      "minLength": 1,
      "type": "string"
    },
    "episode_ordinal": {
      "description": "The fob label ordinal (the label-join source).",
      "type": "integer"
    },
    "firmware_version": {
      "description": "Fob firmware build (provenance.fob_build from the sidecar). Typed column for querying/filtering episodes by firmware version.",
      "type": [
        "string",
        "null"
      ]
    },
    "global_episode_seq": {
      "description": "NAND swap-proof monotonic ordinal \u2014 the PRIMARY ordering spine (card is not a unit).",
      "type": "integer"
    },
    "ingested_at": {
      "description": "When ingest froze this episode; null pre-ingest (WARN here, distinct from release where it is HARD).",
      "type": [
        "string",
        "null"
      ]
    },
    "kit_id": {
      "description": "The kit (from the fob, \u00a73.3). HARD-non-empty \u2014 decides canonical naming + pairing.",
      "minLength": 1,
      "type": "string"
    },
    "needs_review": {
      "description": "Flagged for review (identity/pairing disagreement; never silently overwrite, \u00a73.3).",
      "type": "boolean"
    },
    "paired": {
      "description": "Left+right paired (only paired non-void episodes are training/QA-able, \u00a74.2).",
      "type": "boolean"
    },
    "pairing_anomaly": {
      "description": "episode_id pairing disagreed with the ordinal cross-check (C-12).",
      "type": "boolean"
    },
    "pairing_method": {
      "description": "How L/R were paired (C-12). Hard enum, but the one MOST likely to need a future additive value \u2014 eyes open (\u00a75).",
      "enum": [
        "episode_id",
        "ordinal_join",
        "needs_review"
      ],
      "type": "string"
    },
    "person_id": {
      "description": "Operator/person (roster binding keyed by kit, as-of recorded_at, \u00a73.3).",
      "type": "string"
    },
    "recorded_at": {
      "description": "Fob NTP wallclock (authoritative); the as-of anchor for reference resolution (\u00a73.2, C-10).",
      "type": "string"
    },
    "recording_suspect": {
      "description": "0/1 \u2014 the did-it-actually-record flag (the no-SD trap).",
      "type": "integer"
    },
    "rotation_id": {
      "description": "The PINNED rotation/prompt variant (on the sidecar today; now also pinned on the operational episode, B). Resolved + stored at ingest.",
      "type": [
        "string",
        "null"
      ]
    },
    "schema": {
      "description": "Schema identifier; additive semver (\u00a75).",
      "enum": [
        "eunomia-episode/v1"
      ],
      "type": "string"
    },
    "session_id": {
      "description": "Shift/session identity.",
      "type": "string"
    },
    "side": {
      "description": "Camera side (from camera NAND, \u00a73.3; domain-closed enum). HARD-non-empty \u2014 decides L/R pairing.",
      "enum": [
        "left",
        "right"
      ],
      "minLength": 1,
      "type": "string"
    },
    "sidecar_raw": {
      "description": "Complete raw sidecar JSON as received from the camera. Archived for reprocessing; new firmware fields appear here automatically without schema changes. Promote to typed columns when a consumer needs to query/index them.\n",
      "type": [
        "object",
        "null"
      ]
    },
    "station_id": {
      "description": "Station (from the fob trigger record, \u00a73.3).",
      "type": "string"
    },
    "task_id": {
      "description": "Task identity (the task menu entry; prompt resolved as-of via the task entity).",
      "type": "string"
    },
    "task_version": {
      "description": "The PINNED task version (Run 0e, B). The catalog natural key is (task_id, version, rotation_id); a catalog edit never retroactively changes a past episode. Resolved + stored at ingest (like capture_stack_id).",
      "type": [
        "integer",
        "null"
      ]
    },
    "void": {
      "description": "Voided by flag. void==true REQUIRES void_reason (cross-field rule, OQ-11/\u00a73.2).",
      "type": "boolean"
    },
    "void_reason": {
      "description": "Why voided (required when void==true; the hand-written overlay rule).",
      "type": [
        "string",
        "null"
      ]
    }
  },
  "required": [
    "schema",
    "episode_id",
    "global_episode_seq",
    "kit_id",
    "side",
    "task_id",
    "station_id",
    "session_id",
    "recorded_at"
  ],
  "title": "Episode",
  "type": "object"
}
