{
  "schema": "eunomia-episode/v1",
  "episode_id": "550e8400-e29b-41d4-a716-446655440000",
  "display_id": "20260624_op123_5_000012",
  "bimanual_episode_id": "bi_88",
  "episode_ordinal": 12,
  "global_episode_seq": 1009,
  "kit_id": "kit_07",
  "side": "left",
  "person_id": "p_99",
  "task_id": "t_fold",
  "station_id": "5",
  "session_id": "sess_xyz",
  "calibration_id": "cal_per_cam_1",
  "capture_stack_id": "cs_1",
  "recorded_at": "2026-06-24T10:00:00Z",
  "ingested_at": "2026-06-24T18:00:00Z",
  "paired": true,
  "void": false,
  "void_reason": null,
  "needs_review": false,
  "archive": 0,
  "recording_suspect": 0,
  "pairing_method": "episode_id",
  "pairing_anomaly": false
}
